{
  "text_overlays": [],
  "typography_ui": "The official page does not describe a typeface.",
  "color_grade": "Not stated on the official page.",
  "music_sound": "Not stated on the official page.",
  "voiceover": "Not stated on the official page.",
  "cta": "Not stated beyond the title.",
  "emotional_angle": "The official page does not name an emotional angle.",
  "last_verified": "2026-10-11",
  "rebuild_recipe": [
    "Cut an original spot near 31 seconds.",
    "Put the offer in an original title line before you design shots.",
    "Keep type inside a 16:9 frame only if your own export is horizontal.",
    "Do not copy the brand's logos, characters, art, or exact copy."
  ],
  "id": "yti-30-second-plumbing-commercial",
  "brand": "Lightfoot Mechanical",
  "advertiser": "Lightfoot Mechanical",
  "platform": "youtube_instream",
  "format": "YouTube watch page labeled as a commercial",
  "aspect_ratio": "16:9",
  "length_s": 31,
  "year": null,
  "award": null,
  "niche": "home-services",
  "goal": "conversion",
  "official_url": "https://www.youtube.com/watch?v=6tsqgpPXoNY",
  "hook_0_3s": "The official page does not describe the first three seconds. YouTube's public result for this video titles it: 30 Second Plumbing Commercial",
  "story_beats": [
    "The official title is: 30 Second Plumbing Commercial",
    "The channel on the oEmbed record is Lightfoot Mechanical.",
    "YouTube's public results label for this video states 31 seconds.",
    "The results label does not describe shots, framing, or camera motion."
  ],
  "shot_list": [
    {
      "t": "0-3s",
      "shot": "Opening seconds are not described on the public result.",
      "framing": "Not stated on the official page.",
      "motion": "Not stated on the official page."
    },
    {
      "t": "0-31s",
      "shot": "The result gives a title and a length, and does not list shots.",
      "framing": "Not stated on the official page.",
      "motion": "Not stated on the official page."
    }
  ],
  "pacing": "The public result states 31 seconds and does not describe cut rhythm.",
  "why_it_worked": "YouTube lists “30 Second Plumbing Commercial” at 31 seconds on the Lightfoot Mechanical channel. The usable lesson is the labeled length and the one-line premise in the title, not an unseen picture.",
  "cinematic_qualities": [
    "Public result length of 31 seconds",
    "Title states the commercial premise in one line"
  ],
  "safe_zone_notes": "The results label does not print pixels. This file uses 16:9 because the title presents a TV or Big Game commercial. Confirm the frame on the watch page before you match a safe zone."
}
