{
  "id": "yts-ford-expedition-modes",
  "brand": "Ford Motor Company",
  "advertiser": "Ford Motor Company",
  "platform": "youtube_shorts",
  "format": "YouTube Short",
  "aspect_ratio": "9:16",
  "length_s": 19,
  "year": 2026,
  "award": null,
  "niche": "auto",
  "goal": "consideration",
  "official_url": "https://www.youtube.com/shorts/E7ZPt2wHfgo",
  "hook_0_3s": "The official page does not describe the first three seconds. The page titles the Short: 6 drive modes = 6 ways to road trip. The Ford Expedition®.",
  "story_beats": [
    "The Shorts page titles the video: 6 drive modes = 6 ways to road trip. The Ford Expedition®.",
    "The description opens: Ford Expedition®",
    "The page states 19 seconds, channel Ford Motor Company, published 2026-09-17."
  ],
  "shot_list": [
    {
      "t": "0-3s",
      "shot": "The official page does not describe the opening picture.",
      "framing": "Not stated on the official page.",
      "motion": "Not stated on the official page."
    },
    {
      "t": "0-19s",
      "shot": "The page gives a title and a length, and does not list shots.",
      "framing": "Not stated on the official page.",
      "motion": "Not stated on the official page."
    }
  ],
  "pacing": "The page states 19 seconds and does not describe cut rhythm.",
  "text_overlays": [],
  "typography_ui": "The official page does not describe typeface or weight.",
  "color_grade": "The official page does not describe a color grade.",
  "music_sound": "Not stated on the official page.",
  "voiceover": "Not stated on the official page.",
  "cta": "Not stated on the official page.",
  "emotional_angle": "The official page does not name an emotional angle. The title states the premise.",
  "why_it_worked": "The Ford Motor Company Shorts page states a 19-second vertical video titled “6 drive modes = 6 ways to road trip. The Ford Expedition®.”. That title is the only opening claim the page prints, so a rebuild can copy the structure of a one-line premise plus a short description, not the footage.",
  "cinematic_qualities": [
    "Official URL is a YouTube Shorts watch page",
    "Stated length of 19 seconds"
  ],
  "rebuild_recipe": [
    "Cut an original vertical Short near 19 seconds.",
    "Lead with one original premise line the way this page leads with its title.",
    "If you use chapters, print your own labels. Leave framing and motion to the footage you shoot.",
    "Do not copy the brand's logos, characters, art, or exact copy."
  ],
  "safe_zone_notes": "The watch page does not print a pixel size. This file uses 9:16 because the official URL is a YouTube Short. Keep type clear of the right-side buttons and the bottom caption.",
  "last_verified": "2026-10-11"
}
