{
  "text_overlays": [],
  "typography_ui": "The official page does not describe a typeface.",
  "color_grade": "Not stated on the official page.",
  "music_sound": "Not stated on the official page.",
  "voiceover": "Not stated on the official page.",
  "cta": "Not stated on the official page.",
  "emotional_angle": "The official page does not name an emotional angle.",
  "last_verified": "2026-10-11",
  "rebuild_recipe": [
    "State a hard number, then show the work that changes it.",
    "If you feature a real athlete, clear that use.",
    "Keep the film near 60 seconds.",
    "Do not copy the brand's logos, characters, art, or exact copy."
  ],
  "id": "awd-toyota-good-odds",
  "brand": "Toyota",
  "advertiser": "Toyota",
  "platform": "youtube_instream",
  "format": "TV commercial",
  "aspect_ratio": "16:9",
  "length_s": 60,
  "year": 2018,
  "award": {
    "name": "The One Show",
    "year": 2018,
    "category": "Merit, Craft - Editing / Single",
    "evidence_url": "https://www.oneclub.org/awards/theoneshow/-award/31109/good-odds/"
  },
  "niche": "auto",
  "goal": "awareness",
  "official_url": "https://www.oneclub.org/awards/theoneshow/-award/31109/good-odds/",
  "hook_0_3s": "The official page does not describe the first three seconds. The page calls it a :60-second spot.",
  "story_beats": [
    "The page says the odds of a Paralympic gold are almost 1 billion to 1, and that pushing improves them.",
    "It says the :60 tells the story of alpine skier Lauren Woolstencroft.",
    "The award is a 2018 editing merit. The page does not list cuts."
  ],
  "shot_list": [
    {
      "t": "0-60s",
      "shot": "A :60 about one athlete's odds, as the page summarizes.",
      "framing": "Not stated on the official page.",
      "motion": "Not stated on the official page."
    },
    {
      "t": "edit",
      "shot": "The merit is for editing. The page does not describe the cuts.",
      "framing": "Not stated on the official page.",
      "motion": "Not stated on the official page."
    }
  ],
  "pacing": "The page states a :60 and an editing award, without a cut list.",
  "why_it_worked": "The One Show page states a :60 built on one odds line and one real athlete, recognized for the edit rather than for a new slogan.",
  "cinematic_qualities": [
    "Stated :60",
    "One odds line as the structure"
  ],
  "safe_zone_notes": "The page calls it a :60 spot and does not print pixels. This file uses 16:9 as an unverified TV master."
}
