{
  "text_overlays": [
    {
      "wording": "Loved by everyone, even the saltiest.",
      "size": "Not stated on the official page.",
      "placement": "Spoken in the listing transcript",
      "timing": "end"
    }
  ],
  "typography_ui": "The official page does not describe a typeface.",
  "color_grade": "Not stated on the official page.",
  "music_sound": "Not stated on the official page.",
  "voiceover": "Character dialogue in the listing transcript.",
  "cta": "Not stated on the official page.",
  "emotional_angle": "The official page does not name an emotional angle.",
  "last_verified": "2026-10-11",
  "rebuild_recipe": [
    "Turn one product trait into characters who resist, then give in.",
    "Keep it near 30 seconds and measure the file. This public label is 31 seconds.",
    "Write your own end line.",
    "Do not copy the brand's logos, characters, art, or exact copy."
  ],
  "id": "yti-ritz-island-30",
  "brand": "RITZ Crackers",
  "advertiser": "RITZ Crackers",
  "platform": "youtube_instream",
  "format": "Big Game commercial",
  "aspect_ratio": "16:9",
  "length_s": 31,
  "year": 2026,
  "award": null,
  "niche": "food",
  "goal": "awareness",
  "official_url": "https://www.youtube.com/watch?v=8DoYkQ5wNTA",
  "hook_0_3s": "The official page does not describe the first three seconds. The oEmbed title is RITZ Party | Big Game 2026 Commercial. YouTube's public results label states 31 seconds.",
  "story_beats": [
    "The oEmbed title is RITZ Party | Big Game 2026 Commercial, on the RITZ Crackers channel.",
    "YouTube's public results label for this video states 31 seconds.",
    "The watch page lines are salty characters who refuse a party, then go because of the crackers.",
    "The end line on the watch page is Loved by everyone, even the saltiest."
  ],
  "shot_list": [
    {
      "t": "0-31s",
      "shot": "The watch page is a party the salty characters join.",
      "framing": "Not stated on the official page.",
      "motion": "Not stated on the official page."
    },
    {
      "t": "close",
      "shot": "The end line is Loved by everyone, even the saltiest.",
      "framing": "Not stated on the official page.",
      "motion": "Not stated on the official page."
    }
  ],
  "pacing": "The results label states 31 seconds. The title calls it a Big Game commercial and does not describe the cut rhythm.",
  "why_it_worked": "RITZ's listing is a 30-second party argument that turns the product trait, salty, into the characters who resist the party and then join it.",
  "cinematic_qualities": [
    "Listing length 00:30",
    "A product trait played as characters"
  ],
  "safe_zone_notes": "The results label does not print pixels. The title calls it a Big Game commercial, so 16:9 is an unverified television inference."
}
